{
  "$schema": "./spec/protoscope.schema.json",
  "version": "0.1",
  "product": {
    "name": "Orbit",
    "description": "Demo product: team expense tracking & approvals. Employees submit expenses, managers approve, finance reimburses."
  },
  "viewer": {
    "toolbar": "bottom"
  },
  "dimensions": [
    {
      "id": "role",
      "label": "Role",
      "kind": "role",
      "values": [
        {
          "id": "employee",
          "label": "Employee",
          "description": "Submits own expenses"
        },
        {
          "id": "manager",
          "label": "Manager",
          "description": "Reviews and approves team expenses"
        },
        {
          "id": "finance",
          "label": "Finance",
          "description": "Reimburses approved expenses"
        }
      ]
    },
    {
      "id": "state",
      "label": "Data state",
      "kind": "state",
      "values": [
        {
          "id": "loaded",
          "label": "Loaded"
        },
        {
          "id": "empty",
          "label": "Empty"
        },
        {
          "id": "loading",
          "label": "Loading"
        },
        {
          "id": "error",
          "label": "Error"
        }
      ]
    },
    {
      "id": "lifecycle",
      "label": "Expense lifecycle",
      "kind": "lifecycle",
      "values": [
        {
          "id": "draft",
          "label": "Draft"
        },
        {
          "id": "submitted",
          "label": "Submitted"
        },
        {
          "id": "in-review",
          "label": "In review"
        },
        {
          "id": "approved",
          "label": "Approved"
        },
        {
          "id": "rejected",
          "label": "Rejected"
        },
        {
          "id": "reimbursed",
          "label": "Reimbursed"
        }
      ]
    },
    {
      "id": "step",
      "label": "Flow progress",
      "kind": "process",
      "values": [
        {
          "id": "details",
          "label": "1 · Details"
        },
        {
          "id": "receipt",
          "label": "2 · Receipt"
        },
        {
          "id": "review",
          "label": "3 · Review"
        },
        {
          "id": "done",
          "label": "4 · Done"
        }
      ]
    },
    {
      "id": "density",
      "label": "Density",
      "kind": "preference",
      "values": [
        {
          "id": "comfortable",
          "label": "Comfortable"
        },
        {
          "id": "compact",
          "label": "Compact"
        }
      ]
    },
    {
      "id": "locale",
      "label": "Locale",
      "kind": "locale",
      "values": [
        {
          "id": "en-US",
          "label": "English (US)"
        },
        {
          "id": "de-DE",
          "label": "Deutsch"
        }
      ]
    }
  ],
  "templates": [
    {
      "id": "dashboard-page",
      "label": "Dashboard page",
      "description": "Stat cards + role-specific work queue + activity feed",
      "source": "src/demo/templates/DashboardTemplate.tsx",
      "uiKit": [
        "Card",
        "Badge",
        "Button",
        "Skeleton",
        "Avatar",
        "Separator"
      ],
      "organisms": [
        "work-queue"
      ]
    },
    {
      "id": "list-page",
      "label": "List page",
      "description": "Filter bar + data table with role-aware columns and empty/loading/error states",
      "source": "src/demo/templates/ListTemplate.tsx",
      "uiKit": [
        "Input",
        "Select",
        "Table",
        "Badge",
        "Button",
        "Skeleton",
        "Alert"
      ]
    },
    {
      "id": "detail-page",
      "label": "Detail page",
      "description": "Record header + meta panel + lifecycle timeline + role/lifecycle-aware action bar",
      "source": "src/demo/templates/DetailTemplate.tsx",
      "uiKit": [
        "Card",
        "Badge",
        "Button",
        "Separator",
        "Avatar"
      ],
      "organisms": [
        "approval-actions"
      ]
    },
    {
      "id": "form-flow-page",
      "label": "Form flow page",
      "description": "Multi-step form with progress indicator and confirmation state",
      "source": "src/demo/templates/FormFlowTemplate.tsx",
      "uiKit": [
        "Card",
        "Progress",
        "Input",
        "Label",
        "Select",
        "Textarea",
        "Button"
      ],
      "organisms": [
        "flow-progress"
      ]
    },
    {
      "id": "approval-actions-organism",
      "label": "Approval actions (organism)",
      "description": "Role × lifecycle decision panel",
      "source": "src/demo/organisms/ApprovalActions.tsx",
      "uiKit": [
        "Card",
        "Button"
      ]
    },
    {
      "id": "flow-progress-organism",
      "label": "Flow progress (organism)",
      "description": "Step indicator for multi-step flows",
      "source": "src/demo/organisms/FlowProgress.tsx",
      "uiKit": [
        "Progress"
      ]
    },
    {
      "id": "work-queue-organism",
      "label": "Work queue (organism)",
      "description": "Role-specific list of items needing attention",
      "source": "src/demo/organisms/WorkQueue.tsx",
      "uiKit": [
        "Card",
        "Badge",
        "Skeleton"
      ]
    }
  ],
  "pages": [
    {
      "id": "dashboard",
      "label": "Dashboard",
      "description": "Landing page; content adapts to the viewer's role.",
      "template": "dashboard-page",
      "fidelity": "navigable",
      "dimensions": {
        "role": [
          "employee",
          "manager",
          "finance"
        ],
        "state": [
          "loaded",
          "empty",
          "loading"
        ]
      },
      "defaults": {
        "role": "employee",
        "state": "loaded"
      },
      "instances": [
        {
          "dims": {
            "role": "employee",
            "state": "loaded"
          }
        },
        {
          "dims": {
            "role": "manager",
            "state": "loaded"
          },
          "note": "Manager gets an approvals queue"
        },
        {
          "dims": {
            "role": "finance",
            "state": "loaded"
          },
          "note": "Finance gets a reimbursement queue"
        },
        {
          "dims": {
            "role": "employee",
            "state": "empty"
          },
          "note": "First-run experience"
        },
        {
          "dims": {
            "role": "employee",
            "state": "loading"
          }
        }
      ],
      "annotations": [
        {
          "target": "NewExpenseButton",
          "title": "Primary CTA",
          "note": "Always visible for employees; opens the submit flow. Managers/finance reach it via the top nav instead."
        },
        {
          "target": "PendingApprovalsCard",
          "title": "Work queue",
          "note": "Role-specific queue: managers see items awaiting their review, finance sees the reimbursement queue. Sorted oldest-first."
        },
        {
          "target": "StatCards",
          "title": "Headline numbers",
          "note": "Four KPIs; the set changes per role."
        }
      ]
    },
    {
      "id": "expenses",
      "label": "Expenses list",
      "description": "All expenses visible to the current role, with filters.",
      "template": "list-page",
      "fidelity": "navigable",
      "dimensions": {
        "role": [
          "employee",
          "manager",
          "finance"
        ],
        "state": [
          "loaded",
          "empty",
          "loading",
          "error"
        ]
      },
      "defaults": {
        "role": "employee",
        "state": "loaded"
      },
      "instances": [
        {
          "dims": {
            "role": "employee",
            "state": "loaded"
          }
        },
        {
          "dims": {
            "role": "manager",
            "state": "loaded"
          },
          "note": "Manager sees submitter column + quick actions"
        },
        {
          "dims": {
            "role": "employee",
            "state": "empty"
          }
        },
        {
          "dims": {
            "role": "employee",
            "state": "loading"
          }
        },
        {
          "dims": {
            "role": "employee",
            "state": "error"
          },
          "note": "API failure fallback with retry"
        }
      ],
      "annotations": [
        {
          "target": "ExpenseTable",
          "title": "Mock data",
          "note": "Rows come from fixtures; totals are computed client-side. Clicking a row opens the detail page with the row's lifecycle stage."
        },
        {
          "target": "StatusFilter",
          "title": "Status filter",
          "note": "Filters by lifecycle stage. Finance defaults to 'Approved' because that's their work queue."
        }
      ]
    },
    {
      "id": "expense-detail",
      "label": "Expense detail",
      "description": "A single expense across its whole lifecycle; actions depend on role × lifecycle. Also varies by density and locale (4 dimensions → the toolbar switches to a panel).",
      "template": "detail-page",
      "fidelity": "interactive",
      "dimensions": {
        "role": [
          "employee",
          "manager",
          "finance"
        ],
        "lifecycle": [
          "draft",
          "submitted",
          "in-review",
          "approved",
          "rejected",
          "reimbursed"
        ],
        "density": [
          "comfortable",
          "compact"
        ],
        "locale": [
          "en-US",
          "de-DE"
        ]
      },
      "defaults": {
        "role": "employee",
        "lifecycle": "submitted",
        "density": "comfortable",
        "locale": "en-US"
      },
      "instances": [
        {
          "dims": {
            "role": "employee",
            "lifecycle": "draft"
          },
          "note": "Owner can still edit"
        },
        {
          "dims": {